{
  "languages": {
    "fr": {
      "concrete": "KonstellationFre",
      "profiles": [
        {
          "evidence_ref": "conformance.evidence.json",
          "profile_id": "konstellation-explorer-2",
          "status": "RELEASED"
        }
      ],
      "status": "RELEASED"
    }
  },
  "manifest_id": "cap-konstellation-fr-2",
  "runtime_set_id": "konstellation-fr-2",
  "schema_version": "1.0"
}
